====================================================================================================
=================================== MIGRATION FINALE V3 - SYGFP ====================================
====================================================================================================
Date: 2026-02-06 12:49:51

🔄 ÉTAPE 1/5 : Récupération des données SQL Server...
====================================================================================================

📦 eARTI_DB2 (2021-2023)...
  ✓ Notes: 1994
  ✓ Engagements: 1294
  ✓ Liquidations: 1160
  ✓ Ordonnancements: 1030

📦 eARTIDB_2025 (2024-2025)...
  ✓ Notes: 2660
  ✓ Engagements: 1713
  ✓ Liquidations: 1666
  ✓ Ordonnancements: 1598

📦 eARTIDB_2026 (2026)...
  ✓ Notes: 174
  ✓ Engagements: 144
  ✓ Liquidations: 134
  ✓ Ordonnancements: 100

✅ TOTAL SQL Server: 4828 notes, 3151 engagements, 2960 liquidations, 2728 ordonnancements

====================================================================================================
🔄 ÉTAPE 2/5 : Migration des Notes SEF...
====================================================================================================
  ⚠️  Erreur note 51d67e9d-50ee-d383-7250-afa6334ee203: {'message': 'JSON could not be generated', 'code': 502, 'hint': 'Refer to full message for details', 'details': 'b\'<!DOCTYPE html>\\n<!--[if lt IE 7]> <html class="no-js ie6 oldie" lang="en-US"> <![e
  📊 1,000 notes traitées...
  ⚠️  Erreur note 14da6736-4969-e47c-bd5b-7c8844db75bf: {'message': 'JSON could not be generated', 'code': 502, 'hint': 'Refer to full message for details', 'details': 'b\'<!DOCTYPE html>\\n<!--[if lt IE 7]> <html class="no-js ie6 oldie" lang="en-US"> <![e
  📊 2,000 notes traitées...
  ⚠️  Erreur note a06ee4da-547f-9953-84a9-0876402a6eb5: {'message': 'JSON could not be generated', 'code': 502, 'hint': 'Refer to full message for details', 'details': 'b\'<!DOCTYPE html>\\n<!--[if lt IE 7]> <html class="no-js ie6 oldie" lang="en-US"> <![e
  📊 3,000 notes traitées...
  📊 4,000 notes traitées...

✅ Notes: 4,825 insérées, 0 déjà présentes, 3 erreurs

====================================================================================================
🔄 ÉTAPE 3/5 : Migration des Engagements...
====================================================================================================
  ⚠️  Erreur engagement 26932d6b-8828-be93-496f-1d8dd13b3fa1: {'message': 'JSON could not be generated', 'code': 502, 'hint': 'Refer to full message for details', 'details': 'b\'<!DOCTYPE html>\\n<!--[if lt IE 7]> <html class="no-js ie6 oldie" lang="en-US"> <![e
  ✓ 1,000 engagements traités...
  ⚠️  Erreur engagement f752fe69-1ba2-8459-f931-81a584bc1e25: {'message': 'JSON could not be generated', 'code': 502, 'hint': 'Refer to full message for details', 'details': 'b\'<!DOCTYPE html>\\n<!--[if lt IE 7]> <html class="no-js ie6 oldie" lang="en-US"> <![e
  ⚠️  Erreur engagement cd48b505-4c12-4a37-389f-88315e1dcbf4: {'message': 'JSON could not be generated', 'code': 502, 'hint': 'Refer to full message for details', 'details': 'b\'<!DOCTYPE html>\\n<!--[if lt IE 7]> <html class="no-js ie6 oldie" lang="en-US"> <![e
  ✓ 2,000 engagements traités...
  ✓ 3,000 engagements traités...

✅ Engagements: 3,148 insérés, 0 déjà présents, 3 erreurs

====================================================================================================
🔄 ÉTAPE 4/5 : Migration des Liquidations...
====================================================================================================
  ⚠️  Erreur liquidation e1a0e3ad-0773-0de5-e8fe-0a676d1528cd: {'message': 'JSON could not be generated', 'code': 502, 'hint': 'Refer to full message for details', 'details': 'b\'<!DOCTYPE html>\\n<!--[if lt IE 7]> <html class="no-js ie6 oldie" lang="en-US"> <![e
  ⚠️  Erreur liquidation 138297f9-d3be-74a4-8878-93a21e23f6c3: {'message': 'insert or update on table "budget_liquidations" violates foreign key constraint "budget_liquidations_engagement_id_fkey"', 'code': '23503', 'hint': None, 'details': 'Key (engagement_id)=(
  ⚠️  Erreur liquidation b498df88-2fab-95ad-36d3-305858b258f2: {'message': 'insert or update on table "budget_liquidations" violates foreign key constraint "budget_liquidations_engagement_id_fkey"', 'code': '23503', 'hint': None, 'details': 'Key (engagement_id)=(
  ⚠️  Erreur liquidation c4134ccb-40fb-1ebb-1afe-7f29b4815493: {'message': 'insert or update on table "budget_liquidations" violates foreign key constraint "budget_liquidations_engagement_id_fkey"', 'code': '23503', 'hint': None, 'details': 'Key (engagement_id)=(
  ⚠️  Erreur liquidation d15d7a29-b480-c0f0-d632-afe2a9f6b8d0: {'message': 'insert or update on table "budget_liquidations" violates foreign key constraint "budget_liquidations_engagement_id_fkey"', 'code': '23503', 'hint': None, 'details': 'Key (engagement_id)=(
  ✓ 1,000 liquidations traitées...
  ✓ 2,000 liquidations traitées...
  ✓ 3,000 liquidations traitées...

✅ Liquidations: 2,657 insérées, 0 déjà présentes, 303 erreurs

====================================================================================================
🔄 ÉTAPE 5/5 : Migration des Ordonnancements...
====================================================================================================
  ⚠️  Erreur ordonnancement b60125af-fcf9-8aab-a4dd-f6aa2ad45dad: {'message': 'insert or update on table "ordonnancements" violates foreign key constraint "ordonnancements_liquidation_id_fkey"', 'code': '23503', 'hint': None, 'details': 'Key (liquidation_id)=(0404d5
  ⚠️  Erreur ordonnancement 26a2474a-edea-f280-a5b2-921a79afd60f: {'message': 'insert or update on table "ordonnancements" violates foreign key constraint "ordonnancements_liquidation_id_fkey"', 'code': '23503', 'hint': None, 'details': 'Key (liquidation_id)=(f547bf
  ⚠️  Erreur ordonnancement fefe9904-3ecd-a543-c9a8-279750ec8841: {'message': 'insert or update on table "ordonnancements" violates foreign key constraint "ordonnancements_liquidation_id_fkey"', 'code': '23503', 'hint': None, 'details': 'Key (liquidation_id)=(3a4515
  ⚠️  Erreur ordonnancement 6c9f8905-120f-42d4-9f2a-51c228cd517a: {'message': 'insert or update on table "ordonnancements" violates foreign key constraint "ordonnancements_liquidation_id_fkey"', 'code': '23503', 'hint': None, 'details': 'Key (liquidation_id)=(4241f9
  ⚠️  Erreur ordonnancement 21fd46b9-ef19-e018-e7ed-c704775ba055: {'message': 'insert or update on table "ordonnancements" violates foreign key constraint "ordonnancements_liquidation_id_fkey"', 'code': '23503', 'hint': None, 'details': 'Key (liquidation_id)=(facec5
  ✓ 1,000 ordonnancements traités...
  ✓ 2,000 ordonnancements traités...

✅ Ordonnancements: 2,618 insérés, 0 déjà présents, 110 erreurs

====================================================================================================
=========================================== RÉSUMÉ FINAL ===========================================
====================================================================================================

📊 SQL Server:
   - Notes:           4,828
   - Engagements:     3,151
   - Liquidations:    2,960
   - Ordonnancements: 2,728
   TOTAL:             13,667

✅ Migration:
   - Notes:           4,825 insérées, 3 erreurs
   - Engagements:     3,148 insérés, 3 erreurs
   - Liquidations:    2,657 insérées, 303 erreurs
   - Ordonnancements: 2,618 insérés, 110 erreurs
   TOTAL INSÉRÉ:      13,248

📈 Taux de réussite: 96.9%


 MIGRATION TERMINÉE!
====================================================================================================
